{
  "schema_version": 1,
  "snapshot_id": "rep-002-literature-pre-outcome-2026-09-05",
  "research_question": "Does the exact Henry Hub M1-M6 listed-contract curve exhibit material seasonal structure between winter-withdrawal and injection months?",
  "search_scope": "Fresh Programme 002 literature inventory; Mirantes et al. is direct Henry Hub evidence and Hevia-Petrella is contextual methodology only; no legacy internal outcomes or magnitudes used.",
  "sources": [
    {
      "source_id": "mirantes-et-al-2013",
      "title": "The stochastic seasonal behavior of energy commodity convenience yields",
      "source_type": "peer_reviewed",
      "quality": "primary",
      "locator": "Energy Economics 40 (2013), 155-166",
      "year": 2013
    },
    {
      "source_id": "hevia-petrella-2016",
      "title": "Risk Premia and Seasonality in Commodity Futures",
      "source_type": "academic_working_paper",
      "quality": "high",
      "locator": "Bank of England Staff Working Paper No. 591",
      "year": 2016
    }
  ],
  "claim_map": [
    {
      "claim": "Henry Hub natural gas exhibits material seasonal structure in futures-price relationships and convenience yield.",
      "source_ids": [
        "mirantes-et-al-2013"
      ]
    },
    {
      "claim": "Seasonality can be studied through curve-state comparisons, but Hevia-Petrella is contextual because its empirical application is heating oil.",
      "source_ids": [
        "hevia-petrella-2016"
      ]
    }
  ],
  "expected_observations": [
    "The predeclared winter-withdrawal and injection distributions of monthly M1-M6 log-curve slope differ by at least the scientific MEPI with uncertainty excluding the disconfirming region."
  ],
  "disconfirming_observations": [
    "The seasonal slope contrast is below the scientific MEPI under informative power.",
    "The seasonal pattern disappears when exact listed-contract maturity alignment and the fixed monthly snapshot rule are enforced.",
    "Any apparent seasonal difference depends on changing the M1-M6 statistic, month-selection rule, or season definition after outcome access."
  ]
}
