{
  "schema_version": 1,
  "snapshot_id": "natural-gas-market-replication-285-post-result-v1",
  "research_question": "After observing the #285 exploratory replication, do independent sources support the observed maturity-volatility and seasonal term-structure directions?",
  "search_scope": "Post-result triangulation of the two observed development phenomena without changing the executed construction or promoting development evidence to confirmation.",
  "sources": [
    {
      "source_id": "frau-fanelli-2024-post",
      "title": "Seasonality in commodity prices: new approaches for pricing plain vanilla options",
      "source_type": "peer_reviewed",
      "quality": "high",
      "locator": "https://doi.org/10.1007/s10479-022-05128-x",
      "year": 2024
    },
    {
      "source_id": "cme-energy-calendar-spreads-post",
      "title": "Trading Energy Calendar Spread Options",
      "source_type": "exchange",
      "quality": "primary",
      "locator": "https://www.cmegroup.com/articles/whitepapers/trading-energy-calendar-spread-options.html",
      "year": 2026
    }
  ],  "claim_map": [
    {
      "claim": "Independent Henry Hub evidence describes the Samuelson effect as variation increasing as expiration approaches.",
      "source_ids": ["frau-fanelli-2024-post"]
    },
    {
      "claim": "Independent exchange evidence describes winter natural-gas futures premia and summer/injection-season contango as seasonal term-structure features.",
      "source_ids": ["cme-energy-calendar-spreads-post"]
    }
  ],
  "expected_observations": [
    "A literature-consistent replication should retain greater nearby than distant futures volatility.",
    "A literature-consistent curve should show winter delivery prices systematically above warmer/injection-season delivery prices after removing same-date curve level."
  ],
  "disconfirming_observations": [
    "The observed maturity ordering is inconsistent with independent descriptions of the Samuelson effect.",
    "The observed seasonal curve direction conflicts with the exchange-described winter premium."
  ]
}
