{
  "schema_version": 1,
  "snapshot_id": "front-curve-271-post-result-triangulation-v1",
  "research_question": "After the development-only front-curve feasibility result, does independent external evidence change the interpretation of a HOLD caused by limited history and calendar concentration?",
  "search_scope": "Independent post-result triangulation focused on whether commodity and natural-gas term-structure effects justify overriding an inadequate feasibility gate; no protected Commodity outcomes are inspected.",
  "sources": [
    {"source_id":"fama-french-1987-post","title":"Commodity Futures Prices: Some Evidence on Forecast Power, Premiums, and the Theory of Storage","source_type":"peer_reviewed","quality":"primary","locator":"Journal of Business 60(1):55-73","year":1987},
    {"source_id":"martinez-torro-2023-post","title":"Theory of storage implications in the European natural gas market","source_type":"peer_reviewed","quality":"primary","locator":"doi:10.1016/j.jcomm.2022.100310","year":2023}
  ],
  "claim_map": [
    {"claim":"Term structure can contain economically meaningful information, but external evidence does not remove the need for adequate sample size, dependence-aware inference, and stable coverage in a specific forecasting design.","source_ids":["fama-french-1987-post","martinez-torro-2023-post"]},
    {"claim":"Natural-gas storage theory provides an economic mechanism but is incomplete, so a concentrated or underpowered development sample should remain a feasibility HOLD rather than be promoted on theory alone.","source_ids":["martinez-torro-2023-post"]}
  ],
  "expected_observations": ["If the internal feasibility gate is adequate, external mechanism evidence may support proceeding to a frozen confirmation; it cannot substitute for the gate."],
  "disconfirming_observations": ["If the internal feasibility gate fails on sample adequacy or concentration, external literature does not justify opening protected outcomes." ]
}
